{"schemaVersion":"data.harness/v1","releaseSet":"phase-2","revision":"aaaaaaaaaaaaaaaaaaaaaaaaaaaaaaaaaaaaaaaa","readyForAdlcDecision":true,"evidence":[{"evidenceId":"source-1","kind":"source","status":"passed","digest":"sha256:s"},{"evidenceId":"ci-1","kind":"ci","status":"passed","digest":"sha256:c"},{"evidenceId":"runtime-1","kind":"runtime","status":"passed","digest":"sha256:r"},{"evidenceId":"stakeholder-1","kind":"stakeholder","status":"passed","digest":"sha256:a"}],"compatibility":[{"component":"ADLC","revision":"bbbbbbbbbbbbbbbbbbbbbbbbbbbbbbbbbbbbbbbb","compatible":true,"evidenceId":"compat-1"}]}
